title_pt;title_en;year;rating;genre;sinopse
Besouro Azul;1. Besouro Azul;2023;6.8 (17K);Ação;Jaime Reyes, um adolescente de origem mexicana que encontra um artefato alienígena que lhe dá um exoesqueleto mecanizado e poderes, tornando-o no Besouro Azul.
Barbie;2. Barbie;2023;7.4 (255K);Aventura;Viver na Terra da Barbie é ser um ser perfeito em um lugar perfeito. A menos que você tenha uma crise existencial completa. Ou que você seja um Ken.
Oppenheimer;3. Oppenheimer;2023;8.6 (381K);Biografia;A história do cientista americano J. Robert Oppenheimer e o seu papel no desenvolvimento da bomba atômica.
As Tartarugas Ninja: Caos Mutante;4. As Tartarugas Ninja: Caos Mutante;2023;7.5 (19K);Animação;Os irmãos Tartaruga trabalham para conquistar o amor da cidade de Nova York enquanto enfrentam um exército de mutantes.
Ruim Pra Cachorro;5. Ruim Pra Cachorro;2023;6.4 (3.2K);Animação;Um cachorro abandonado se une a outros vira-latas para se vingar de seu antigo dono.
Megatubarão 2;6. Megatubarão 2;2023;5.4 (21K);Ação;Segue um piloto de submersível e um grupo de cientistas em águas profundas para explorar uma trincheira desconhecida na Fossa das Marianas. No caminho, eles encontrarão o Megalodon, um gigante tubarão pré-histórico.
Fale Comigo;7. Fale Comigo;2022;7.4 (25K);Terror;Um grupo de amigos descobre uma mão embalsamada que lhes permite conjurar espíritos. Viciado na emoção, um deles vai longe demais e abre a porta para o mundo espiritual.
Mansão Mal-Assombrada;8. Mansão Mal-Assombrada;2023;6.2 (11K);Comédia;Uma mãe e seu filho de nove anos estão tentando começar uma nova vida. Eles aproveitam uma oportunidade imperdível, uma adorável mansão em Nova Orleans.
Missão: Impossível - Acerto de Contas Parte Um;9. Missão: Impossível - Acerto de Contas Parte Um;2023;8.0 (131K);Ação;Ethan Hunt e seu grupo do IMF embarcam na missão mais arriscada até agora: localizar uma nova arma aterrorizante que ameaça toda a humanidade antes que caia nas mãos erradas.
Som da Liberdade;10. Som da Liberdade;2023;7.8 (49K);Ação;A incrível história real de um ex-agente governamental que se transforma em um vigilante e que embarca em uma missão perigosa para resgatar centenas de crianças das mãos de traficantes sexuais.
Um Sonho de Liberdade;1. Um Sonho de Liberdade;1994;9.3;Drama;Dois homens presos se reúnem ao longo de vários anos, encontrando consolo e eventual redenção através de atos de decência comum.
O Poderoso Chefão;2. O Poderoso Chefão;1972;9.2;Policial;O patriarca idoso de uma dinastia do crime organizado transfere o controle de seu império clandestino para seu filho relutante.
Batman: O Cavaleiro das Trevas;3. Batman: O Cavaleiro das Trevas;2008;9.0;Ação;Quando a ameaça conhecida como O Coringa surge de seu passado, causa estragos e caos nas pessoas de Gotham. O Cavaleiro das Trevas deve aceitar um dos maiores testes para combater a injustiça.
O Poderoso Chefão II;4. O Poderoso Chefão II;1974;9.0;Policial;Em 1950, Michael Corleone, agora à frente da família, tenta expandir o negócio do crime a Las Vegas, Los Angeles e Cuba. Paralelamente, é revelada a história de Vito Corleone, e de como saiu da Sicília e chegou a Nova Iorque.
12 Homens e uma Sentença;5. 12 Homens e uma Sentença;1957;9.0;Policial;O julgamento de um assassinato em Nova Iorque é frustrado por um único membro, cujo ceticismo força o júri a considerar cuidadosamente as evidências antes de dar o veredito.
A Lista de Schindler;6. A Lista de Schindler;1993;9.0;Biografia;Na Polônia ocupada pelos alemães durante a Segunda Guerra Mundial, o industrial Oskar Schindler começa a ser preocupar com seus trabalhadores judeus depois de testemunhar sua perseguição pelos nazistas.
O Senhor dos Anéis: O Retorno do Rei;7. O Senhor dos Anéis: O Retorno do Rei;2003;9.0;Ação;Gandalf e Aragorn lideram o Mundo dos Homens contra o exército de Sauron para desviar o olhar de Frodo e Sam quando eles se aproximam á Montanha da Perdição com o Um Anel.
Pulp Fiction - Tempo de Violência;8. Pulp Fiction - Tempo de Violência;1994;8.9;Policial;As vidas de dois assassinos da máfia, um boxeador, um gângster e sua esposa, e um par de bandidos se entrelaçam em quatro histórias de violência e redenção.
O Senhor dos Anéis: A Sociedade do Anel;9. O Senhor dos Anéis: A Sociedade do Anel;2001;8.8;Ação;Um manso hobbit do Condado e oito companheiros partem em uma jornada para destruir o poderoso Um Anel e salvar a Terra-média das Trevas.
Três Homens em Conflito;10. Três Homens em Conflito;1966;8.8;Aventura;Um impostor se junta com dois homens para encontrar fortuna num remoto cemitério.
Forrest Gump: O Contador de Histórias;11. Forrest Gump: O Contador de Histórias;1994;8.8;Drama;Os governos dos presidentes Kennedy e Johnson, os eventos do Vietnã e Watergate e outras histórias são mostradas através da perspectiva de um homem do Alabama com baixo quociente intelectual.
Clube da Luta;12. Clube da Luta;1999;8.8;Drama;Um trabalhador de escritório e um fabricante de sabonetes formam um clube de luta clandestino que evolui para algo muito maior.
O Senhor dos Anéis: As Duas Torres;13. O Senhor dos Anéis: As Duas Torres;2002;8.8;Ação;Enquanto Frodo e Sam estão perto de Mordor com a ajuda de Gollum, a divida comunhão luta contra Saruman e os Isengards.
A Origem;14. A Origem;2010;8.8;Ação;Um ladrão que rouba segredos corporativos através da tecnologia de entrar no subconsciente recebe a tarefa inversa de plantar uma idéia na mente do diretor de uma grande empresa.
Star Wars: Episódio V - O Império Contra-Ataca;15. Star Wars: Episódio V - O Império Contra-Ataca;1980;8.7;Ação;Os rebeldes derrotaram o Império no planeta congelado Hoth. Luke Skywalker começa a treinar como um Jedi com Yoda, enquanto seus amigos são perseguidos por Darth Vader.
Matrix;16. Matrix;1999;8.7;Ação;Um hacker aprende com os misteriosos rebeldes sobre a verdadeira natureza de sua realidade e seu papel na guerra contra seus controladores.
Homem-Aranha: Através do Aranhaverso;17. Homem-Aranha: Através do Aranhaverso;2023;8.8;Animação;Miles Morales, o amigão da vizinhança Homem-Aranha, é transporado através do multiverso para unir forças com Gwen Stacy e um novo time de Pessoas-Aranha para enfrentar um vilão mais poderoso do que qualquer coisa que já tenham encontrado.
Os Bons Companheiros;18. Os Bons Companheiros;1990;8.7;Biografia;A historia do Henry Hill e sua vida na máfia, sua relação com sua esposa Karen Hill e seus colegas da máfia Jimmy Conway e Tommy DeVito no sindicato italo-americano do crime.
Um Estranho no Ninho;19. Um Estranho no Ninho;1975;8.7;Drama;Um criminoso alega insanidade para ser enviado a um centro de saúde mental, onde se rebela contra a opressiva enfermeira e mobiliza os pacientes a quem ela atemoriza.
Seven: Os Sete Crimes Capitais;20. Seven: Os Sete Crimes Capitais;1995;8.6;Policial;Dois detetives, um novato e um veterano, perseguem um assassino em série que usa os sete pecados capitais como motivos.
A Felicidade Não se Compra;21. A Felicidade Não se Compra;1946;8.6;Drama;Um anjo é enviado dos céus para ajudar um homem de negócios desesperado em sua frustração, e mostra a ele como seria a vida se nunca tivesse existido.
Os Sete Samurais;22. Os Sete Samurais;1954;8.6;Ação;Uma aldeia pobre sob a ameaça de bandidos recruta sete samurais para ajudá-los a se defenderem.
O Silêncio dos Inocentes;23. O Silêncio dos Inocentes;1991;8.6;Policial;Uma jovem deve receber a ajuda de um assassino canibal manipulador e preso para ajudar a capturar outro assassino em série, um louco que ataca suas vítimas.
Interestelar;24. Interestelar;2014;8.7;Aventura;Uma equipe de exploradores viaja através de um buraco de minhoca no espaço, na tentativa de garantir a sobrevivência da humanidade.
O Resgate do Soldado Ryan;25. O Resgate do Soldado Ryan;1998;8.6;Drama;Depois de chegar a Normandía, um grupo de soldados precisam encontrar ao unico irmão vivo de tres que morreram na guerra.
Cidade de Deus;26. Cidade de Deus;2002;8.6;Policial;Os caminhos de duas crianças divergem nas favelas do Rio, enquanto um se esforça para se tornar um fotógrafo e o outro um chefe do tráfico.
A Vida é Bela;27. A Vida é Bela;1997;8.6;Comédia;Quando um bibliotecário judeu e seu filho se tornarem vítimas do Holocausto, ele usará uma mistura perfeita de vontade, humor e imaginação para proteger seu filho dos perigos do campo de concentração.
À Espera de um Milagre;28. À Espera de um Milagre;1999;8.6;Policial;As vidas dos guardas de corredor da morte são afetadas por um dos detidos: um homem afro-americano acusado pelo assassinato e estupro de uma criança, mas com um presente misterioso.
Star Wars: Episódio IV - Uma Nova Esperança;29. Star Wars: Episódio IV - Uma Nova Esperança;1977;8.6;Ação;Luke Skywalker une forças com um cabaleiro Jedi, um arrogante piloto é dois dróides para salvar a galaxia enquanto tentam salvar a princesa Leia do misterioso Darth Vader.
O Exterminador do Futuro 2: O Julgamento Final;30. O Exterminador do Futuro 2: O Julgamento Final;1991;8.6;Ação;Um ciborgue, idêntico àquele que não conseguiu matar Sarah Connor, deve agora proteger seu filho adolescente, John Connor, de um ciborgue mais avançado e poderoso.
De Volta para o Futuro;31. De Volta para o Futuro;1985;8.5;Aventura;Marty McFly viaja para 1955 com a máquina do tempo do cientista Dr. Brown. Ele deve garantir que seus pais se apaixonem, para não arriscar sua própria existência.
A Viagem de Chihiro;32. A Viagem de Chihiro;2001;8.6;Animação;Durante a mudança de casa, uma menina de dez anos se maravilha num mundo de dioses, bruxas e espíritus e onde os humanos são transformados em bestas.
O Pianista;33. O Pianista;2002;8.5;Biografia;Um musico judeu luta para sobreviver a destruição de Varsóvia durante a segunda guerra mundial.
Psicose;34. Psicose;1960;8.5;Terror;Uma secretária de Phoenix desvia dinheiro de um cliente de sua empresa, foge e vai a um motel remoto gerido por um jovem sob o domínio da mãe.
Parasita;36. Parasita;2019;8.5;Drama;Desempregados, a família de Ki-taek (Song Kang-ho) nutre um interesse peculiar pela família Park até que eles se veem presos em um inesperado incidente.
Gladiador;37. Gladiador;2000;8.5;Ação;Um general romano planeja a melhor vingança contra o imperador corrupto que matou sua familia e o fez escravo.
O Rei Leão;38. O Rei Leão;1994;8.5;Animação;Um pequeno lion é obrigado por seu tío a fugir de casa e anos depois se da conta da sua identidade e suas responsabilidades.
O Profissional;39. O Profissional;1994;8.5;Ação;Mathilda, uma menina de 12 anos é levada por Léon, um assassino profissional, depois que sua família é assassinada. Léon e Mathilda formam uma relação incomum, desde que ela se torna sua protegida.
A Outra História Americana;40. A Outra História Americana;1998;8.5;Policial;Um neonazista tenta evitar que seu irmão mais novo tome o mesmo caminho errado que ele.
Os Infiltrados;41. Os Infiltrados;2006;8.5;Policial;Um policial disfarçado e um espião estão tentando se identificar enquanto se infiltram em uma gangue irlandesa no sul de Boston.
Whiplash: Em Busca da Perfeição;42. Whiplash: Em Busca da Perfeição;2014;8.5;Drama;Um jovem e promissor baterista se matricula em um conservatório de música onde seus sonhos são guiados por um instrutor que não pára por nada para perceber o potencial de um aluno.
O Grande Truque;43. O Grande Truque;2006;8.5;Drama;Depois de um trágico acidente, dois magos do palco se engajam em uma batalha para criar a ilusão final enquanto sacrificam tudo o que têm para enganar um ao outro.
Os Suspeitos;44. Os Suspeitos;1995;8.5;Policial;O único sobrevivente conta os torcidos eventos duma luta com pistolas num bote, quanfo cinco criminais eram levados pela polícia.
Túmulo dos Vagalumes;45. Túmulo dos Vagalumes;1988;8.5;Animação;Um menino e sua irmã tentam sobreviver no Japão durante a Segunda Guerra Mundial.
Casablanca;46. Casablanca;1942;8.5;Drama;O proprietário cético de uma boate protege um antigo amor e seu marido dos nazistas no Marrocos.
Harakiri;47. Harakiri;1962;8.6;Ação;Um velho samurai ronin chega à casa de um senhor feudal e pede um lugar honroso para cometer suicídio. Mas quando o ronin pede um samurai mais jovem que chegou antes, os eventos seguem um curso inesperado.
Intocáveis;48. Intocáveis;2011;8.5;Biografia;Depois de ficar tetraplégico num acidente, um aristocrata contrata um jovem de um bairro pobre para cuidar dele.
Tempos Modernos;49. Tempos Modernos;1936;8.5;Comédia;Um vagabundo luta para viver na sociedade industrial moderna com a ajuda de uma jovem.
Cinema Paradiso;50. Cinema Paradiso;1988;8.5;Drama;Um diretor de cinema lembra como, em sua infância, ele se apaixonou pelo cinema de sua cidade e iniciou uma profunda amizade com o projecionista.
Era uma Vez no Oeste;51. Era uma Vez no Oeste;1968;8.5;Faroeste;Um misterioso estranhoe se junta com um bandido para proteger a uma viúva.
Janela Indiscreta;52. Janela Indiscreta;1954;8.5;Mistério;Um fotógrafo em uma cadeira de rodas espiona seus vizinhos pela janela de seu apartamento e está convencido de que um deles cometeu um assassinato.
Alien - O 8º Passageiro;53. Alien - O 8º Passageiro;1979;8.5;Terror;Depois que um navio mercante do espaço percebe uma transmissão desconhecida como uma chamada de socorro, encontra um dos tripulantes atacado por um misterioso modo de vida, e logo percebem que seu ciclo de vida simplesmente começou.
Luzes da Cidade;54. Luzes da Cidade;1931;8.5;Comédia;Com a ajuda de um homem rico, bêbado e imprevisível, um vagabundo ingênuo que se apaixonou por uma florista cega tenta conseguir dinheiro para fornecer ajuda médica.
Apocalypse Now;55. Apocalypse Now;1979;8.4;Drama;Um oficial do exército dos Estados Unidos no Vietnã é encarregado de assassinar a um coronel que acredita ser um deus.
Amnésia;56. Amnésia;2000;8.4;Mistério;Um homem com perda da memória de curto prazo tenta investigar o homicídio da sua esposa.
Django Livre;57. Django Livre;2012;8.4;Drama;Com a ajuda de um caçador de recompensas alemão, um escravo libertado sai para resgatar sua esposa de um brutal dono de uma plantação no Mississipi.
Os Caçadores da Arca Perdida;58. Os Caçadores da Arca Perdida;1981;8.4;Ação;Em 1936 o archeologista e aventurero Indiana Jones é contratado pelo governo dos Estados Unidos para procurar pelo Pacto da Arca, antes que os nazis o tenham primeiro.
WALL·E;59. WALL·E;2008;8.4;Animação;Num futuro distante, um pequeno robô faz uma viagem que decidirá o destino da humanidade.
A Vida dos Outros;60. A Vida dos Outros;2006;8.4;Drama;Em 1984, em Berlim Oriental, um agente da polícia secreta que cuida de um escritor e sua mulher se vê cada vez mais absorvido em suas vidas.
Crepúsculo dos Deuses;61. Crepúsculo dos Deuses;1950;8.4;Drama;Um roteirista estabelece uma relação com uma fracasada estrela de cinema que quer voltar aos filmes.
Glória Feita de Sangue;62. Glória Feita de Sangue;1957;8.4;Drama;Depois de se recusar a atacar uma posição inimiga, um general acusa os soldados da covardia e seu comandante deve defendê-los.
Vingadores: Guerra Infinita;63. Vingadores: Guerra Infinita;2018;8.4;Ação;Os Vingadores e seus aliados deverão sacrificar tudo em uma tentativa de derrotar o poderoso Thanos antes que sua explosão de devastação ponha fim ao universo.
O Iluminado;64. O Iluminado;1980;8.4;Drama;Uma família se dirige a um hotel isolado para o inverno, onde uma presença sinistra influencia a violência do pai, enquanto seu filho psíquico vê presságios horríveis do passado e do futuro.
O Grande Ditador;65. O Grande Ditador;1940;8.4;Comédia;O ditador Hynkel tenta expandir seu império enquanto um pobre barbeiro judeu tenta evitar a perseguição do regime de Hynkel.
Testemunha de Acusação;66. Testemunha de Acusação;1957;8.4;Policial;Um veterano advogado britânico deve defender seu cliente em um julgamento de assassinato que tem surpresa após surpresa.
Homem-Aranha: No Aranhaverso;67. Homem-Aranha: No Aranhaverso;2018;8.4;Animação;Um jovem se torna o Homem Aranha de sua realidade, cruzando seu caminho com cinco colegas de outras dimensões para impedir uma ameaça a todas as realidades.
Aliens, O Resgate;68. Aliens, O Resgate;1986;8.4;Ação;Ellen Ripley é salvada depois de estar dormida por 57 anos. A luna que o Nostromo visitou foi colonizada mas o contado se perdeu.
Beleza Americana;69. Beleza Americana;1999;8.3;Drama;Um pai sexualmente frustrado tem uma crise existencial depois de conhecer a melhor amiga da sua filha.
Batman: O Cavaleiro das Trevas Ressurge;70. Batman: O Cavaleiro das Trevas Ressurge;2012;8.4;Ação;Oito anos depois da anarquia do Coringa, Batman com ajuda da Mulher Gato, tentam salvar Gotham do terrorista Bane.
Bastardos Inglórios;71. Bastardos Inglórios;2009;8.3;Aventura;Na França ocupada pelos nazistas durante a Segunda Guerra Mundial, um plano para assassinar líderes nazistas por parte de um grupo de soldados judeus dos EUA coincide com os planos de vingança da dona de uma sala de cinema.
Dr. Fantástico;72. Dr. Fantástico;1964;8.4;Comédia;Um general alienado provoca um potencial holocausto nuclear que uma sala de guerra cheia de políticos e generais tenta freneticamente parar.
Oldboy;73. Oldboy;2003;8.4;Ação;Depois de ter sido raptado e preso por quinze anos, Oh Dae-Su é libertado, e descobre que tem 5 dias para encontrar seu sequestrador.
Viva: A Vida é uma Festa;74. Viva: A Vida é uma Festa;2017;8.4;Animação;Miguel entra na terra dos mortos para encontrar a seu bisavó quem era um lendário cantante.
Amadeus;75. Amadeus;1984;8.4;Biografia;A vida, sucessos e tribulações de Wolfgang Amadeus Mozart de acordo com Antonio Salieri, um compositor que era contemporâneo, que sempre teve ciúmes dele e que alegou tê-lo matado.
Toy Story;76. Toy Story;1995;8.3;Animação;Um brinquedo do cauboi se sente profundamente ameaçado e celoso quando um brinquedo patrulheiro espacial passa a ter mais atençao do garoto.
Coração Valente;77. Coração Valente;1995;8.3;Biografia;Quando sua noiva en segredo é assassinada, William Wallace comença uma revolta contra o rey Eduardo I da Inglaterra.
O Barco: Inferno no Mar;78. O Barco: Inferno no Mar;1981;8.4;Drama;O mundo claustrofóbico de um submarino da Segunda Guerra Mundial, cheio de tédio, sujeira e terror.
Coringa;79. Coringa;2019;8.4;Policial;Um comediante falido enlouquece e se torna um assassino psicopata.
Vingadores: Ultimato;80. Vingadores: Ultimato;2019;8.4;Ação;Após os eventos devastadores de Vingadores: Guerra Infinita , o universo está em ruínas, e com a ajuda de aliados os Vingadores se reúnem para desfazer as ações de Thanos e restaurar a ordem.
Princesa Mononoke;81. Princesa Mononoke;1997;8.3;Animação;Numa viagem para descobrir a cura contra a maldição de Tatarigami, Ashitaka, se encontra uma guerra entre os deuses da foresta e Tatara, uma colônia mineira.
Gênio Indomável;82. Gênio Indomável;1997;8.3;Drama;Will Hunting, um zelador duma Universidade, tem habilidades para a matemática, mas precisa da ajuda dum psicólogo para encontrar seu propósito.
Era uma Vez na América;83. Era uma Vez na América;1984;8.3;Policial;Um ex criminal judeu da época da proibição volta a Manhattan onde deberá confrontar seu pasado.
Your Name.;84. Your Name.;2016;8.4;Animação;Dois estranhos estão ligados de uma maneira bizarra, mais quando uma conexão é formada, a distância será a única coisa que os manterá separados?
3 Idiotas;85. 3 Idiotas;2009;8.4;Comédia;Dois amigos procuram seu companheiro perdido. Eles se lembram de seus dias de faculdade e como seu amigo os inspirou a pensar de maneira diferente, mesmo quando o resto do mundo os chamava idiotas.
Céu E Inferno;86. Céu E Inferno;1963;8.4;Policial;Um executivo de uma empresa de calçados torna-se vítima de extorsão quando o filho de seu motorista é sequestrado e retido para resgate.
Cantando na Chuva;87. Cantando na Chuva;1952;8.3;Comédia;Uma produtora de cinema e elenco fazem uma transição difíci.
Réquiem para um Sonho;88. Réquiem para um Sonho;2000;8.3;Drama;As utopias causadas pelo uso de drogas em quatro pessoas de Coney Island se rompem quando seus vícios as dominam.
Cafarnaum;89. Cafarnaum;2018;8.4;Drama;Ao cumprir uma sentença de cinco anos por um crime violento, uma criança de 12 anos processou seus pais por negligência.
Toy Story 3;90. Toy Story 3;2010;8.3;Animação;Os brinquedos são dados por erro a uma creche, Woody junto com os outros brinquedos tentaram voltar a casa do Andy.
Vá e Veja;91. Vá e Veja;1985;8.4;Drama;Depois de encontrar uma arma, um jovem se une as forças da resistença russa contra os alemães na segunda guerra mundial.
Star Wars, Episódio VI: O Retorno do Jedi;92. Star Wars, Episódio VI: O Retorno do Jedi;1983;8.3;Ação;Depois de uma missão ousada para resgatar Han Solo da cabana de Jabba, os rebeldes partem para fazer Endor destruir a mais poderosa Estrela da Morte. Enquanto isso, Luke tenta trazer Darth Vader de volta do lado negro, sem cair na armadilha do Imperador.
Brilho Eterno de uma Mente sem Lembranças;93. Brilho Eterno de uma Mente sem Lembranças;2004;8.3;Drama;Quando sua relaçao se volta complicada, um casal tenta um procedimento médico para que suas memorias sejam apagadas.
2001: Uma Odisséia no Espaço;94. 2001: Uma Odisséia no Espaço;1968;8.3;Aventura;Trás descobrir um misterioso artefato na superfície da Lua, a humanidade tenta encontrar seus origens com a ajuda da inteligença do ordernador HAL 9000.
A Caça;95. A Caça;2012;8.3;Drama;Um professor vive uma vida solitária enquanto luta pela custódia de seu filho. Sua vida melhora lentamente quando ele encontra o amor e recebe boas notícias de seu filho, mas sua sorte está prestes a mudar por uma pequena mentira inocente.
Cães de Aluguel;96. Cães de Aluguel;1992;8.3;Policial;Quando um simples roubo de jóias dá errado, os criminosos sobreviventes começam a suspeitar que um deles é um informante da polícia.
Viver;97. Viver;1952;8.3;Drama;Depois de descobrir que tem câncer terminal, um burocrata tenta encontrar um sentido para sua vida.
Lawrence da Arábia;98. Lawrence da Arábia;1962;8.3;Aventura;A história de T. E. Lawrence, o oficial inglês que conseguiu unir e liderar várias tribos árabes, durante a Primeira Guerra Mundial para lutar contra os turcos.
Cidadão Kane;99. Cidadão Kane;1941;8.3;Drama;Após a morte de um magnata na indústria editorial, jornalistas correm para descobrir o significado da última palavra que ele pronunciou.
M, o Vampiro de Dusseldorf;100. M, o Vampiro de Dusseldorf;1931;8.3;Policial;Quando a polícia de uma cidade alemã não consegue encontrar um assassino de crianças, outros criminosos decidem ajudar na caçada humana.
Intriga Internacional;101. Intriga Internacional;1959;8.3;Ação;Um executivo de publicidade de Nova Iorque tem que fugir quando é confundido por um agente de governo.
Se Meu Apartamento Falasse;102. Se Meu Apartamento Falasse;1960;8.3;Comédia;Um homem tenta subir na empresa permitindo que seus executivos usem seu apartamento para encontros, mas surgem complicações e um romance próprio.
Um Corpo que Cai;103. Um Corpo que Cai;1958;8.3;Mistério;Um ex-policial luta contra seus demônios enquanto está obcecado por uma mulher bonita.
Pacto de Sangue;104. Pacto de Sangue;1944;8.3;Policial;Um agente de seguros se deixa convencer de um esquema de assassinato e fraude, o que desperta a suspeita de um investigador.
O Fabuloso Destino de Amélie Poulain;105. O Fabuloso Destino de Amélie Poulain;2001;8.3;Comédia;Amélie é uma parisiense ingênua com seu próprio senso de justiça. Ela decide ajudar as pessoas ao seu redor e, no caminho, descobre o amor.
Scarface;106. Scarface;1983;8.3;Policial;Em Miamo em 1980, um imigrante cubano toma o control dum cartel de drogas.
Nascido para Matar;107. Nascido para Matar;1987;8.3;Drama;Um marinho dos Estados Unidos nota os deshumanizantes efeitos da guerra do Vietnã em seus colegas.
Laranja Mecânica;108. Laranja Mecânica;1971;8.3;Policial;No futuro, um jovem líder de gang é levado para prisão e decide ser voluntário em um experimento, mas os resultados não são os esperados.
Incêndios;109. Incêndios;2010;8.3;Drama;Os gêmeos viajam para o Oriente Médio para descobrir sua história familiar e cumprir os últimos desejos de sua mãe.
Hamilton;110. Hamilton;2020;8.3;Biografia;A vida de um dos maiores fundadores e primeiro secretário do Tesouro da América, Alexander Hamilton.
Fogo Contra Fogo;111. Fogo Contra Fogo;1995;8.3;Ação;Um grupo de profissionais roubando bancos sospeitam que a polícia está tráis deles quando deixam uma pista no seu último roubo.
Up: Altas Aventuras;112. Up: Altas Aventuras;2009;8.3;Animação;Carl Fredricksen, de 78 anos, viaja a Paraside Falls com sua casa e inadvertidamente leva um menino com ele.
O Sol é para Todos;113. O Sol é para Todos;1962;8.3;Policial;Atticus Finch, um advogado no sul da era da Depressão, defende um homem negro contra uma acusação de estupro imerecida, e seus filhos contra o preconceito.
Golpe de Mestre;114. Golpe de Mestre;1973;8.3;Comédia;Dois golpistas se reúnem para obter o melhor golpe.
A Separação;115. A Separação;2011;8.3;Drama;Um casal é confrontado com uma decisão difícil, melhorar a vida de seu filho mudando-se para outro país ou ficar no Irã e cuidar de um pai que se deteriora e com Alzheimer.
Indiana Jones e a Última Cruzada;116. Indiana Jones e a Última Cruzada;1989;8.2;Ação;"Em 1938, depois que seu pai, o professor Henry Jones, desaparece enquanto persegue o Santo Graal, o professor Henry ""Indiana"" Jones, Jr. se encontra contra os nazistas de Adolf Hitler."
